{
  "schemaVersion": "2.0",
  "profile": {
    "documentTitle": "キャリアシート",
    "name": "山田 太郎",
    "nameReading": "やまだ たろう",
    "professionalTitle": "ITエンジニア / 業務システム・データ活用",
    "tagline": "業務理解から設計・実装・改善まで、価値につなげるエンジニアリング。",
    "affiliation": "株式会社サンプルテック"
  },
  "summary": {
    "statement": "業務部門へのヒアリングから要件整理、設計、実装、運用改善まで一貫して担当してきたITエンジニアです。データ処理と可視化を得意とし、利用者が継続して活用できる仕組みづくりを重視しています。",
    "experienceDomains": [
      "製造業向けデータ活用",
      "業務システム開発"
    ],
    "coreCapabilities": [
      "要件整理",
      "設計・実装",
      "運用改善"
    ],
    "coreTechnologies": [
      "Python",
      "SQL",
      "JavaScript"
    ],
    "availableRoles": [
      "データ可視化システム開発",
      "業務改善支援"
    ],
    "qualificationHighlights": [
      "応用情報技術者試験"
    ]
  },
  "careerEntries": [
    {
      "id": "career-1",
      "period": {
        "from": "2022.04",
        "to": "現在"
      },
      "role": "ソフトウェアエンジニア",
      "organizationLabel": "製造業向け開発部門",
      "industry": "製造業 / データ活用",
      "summary": "業務データの収集・加工・可視化を行うシステムの設計、開発、運用改善を担当。",
      "highlights": [
        "データ可視化システムを構築",
        "定型データ処理を自動化"
      ]
    },
    {
      "id": "career-2",
      "period": {
        "from": "2020.04",
        "to": "2022.03"
      },
      "role": "システム開発エンジニア",
      "organizationLabel": "社内業務システム開発案件",
      "industry": "業務システム",
      "summary": "既存システムの機能追加、テスト、運用保守を担当。",
      "highlights": [
        "業務画面の改善",
        "テスト手順と運用資料を整備"
      ]
    }
  ],
  "projects": [
    {
      "id": "project-1",
      "title": "業務データ可視化システム開発",
      "period": {
        "from": "2024.04",
        "to": "2025.03"
      },
      "role": "開発担当",
      "organizationLabel": "製造業向け / 研究開発部門",
      "summary": "複数のデータファイルを取り込み、検索・可視化・レポート出力まで行うWebシステムを構築。",
      "background": "手作業でのデータ整理とグラフ作成に時間がかかり、担当者ごとに作業手順が異なっていました。",
      "responsibilities": [
        "業務ヒアリング",
        "画面・データ構造設計",
        "実装・テスト",
        "利用者向け説明",
        "運用改善"
      ],
      "process": [
        {
          "label": "要件整理",
          "description": "利用者へのヒアリングと現行作業の確認"
        },
        {
          "label": "設計",
          "description": "画面構成とデータ処理フローを設計"
        },
        {
          "label": "実装",
          "description": "データ取込、可視化、出力機能を開発"
        },
        {
          "label": "運用改善",
          "description": "利用状況を確認し、操作性を継続改善"
        }
      ],
      "approaches": [
        "既存業務を観察し、操作手順を減らす画面構成にした",
        "処理結果を途中確認できるようにして、原因調査をしやすくした"
      ],
      "deliverables": [
        "Webダッシュボード",
        "データ処理機能",
        "運用手順書"
      ],
      "achievements": [
        {
          "statement": "定型的な集計・グラフ作成を自動化",
          "metric": "作業時間を約50%短縮",
          "evidence": "旧手順と新手順の作業時間を比較"
        },
        {
          "statement": "利用者が自分で条件を変更して分析できる環境を整備",
          "metric": "",
          "evidence": "利用者へのヒアリング結果"
        }
      ],
      "technologies": [
        "Python",
        "FastAPI",
        "Plotly",
        "SQL",
        "HTML/CSS"
      ],
      "team": {
        "size": "5名",
        "position": "開発担当"
      },
      "visuals": [],
      "layoutHint": "auto"
    }
  ],
  "skills": {
    "categories": [
      {
        "name": "プログラミング言語",
        "items": [
          {
            "name": "Python",
            "proficiency": "core",
            "experienceYears": 4,
            "lastUsed": "現在",
            "contexts": [
              "データ処理",
              "可視化",
              "Web API"
            ]
          },
          {
            "name": "JavaScript",
            "proficiency": "working",
            "experienceYears": 2,
            "lastUsed": "2025",
            "contexts": [
              "画面制御"
            ]
          }
        ]
      },
      {
        "name": "データベース・分析",
        "items": [
          {
            "name": "SQL",
            "proficiency": "core",
            "experienceYears": 4,
            "lastUsed": "現在",
            "contexts": [
              "データ抽出",
              "集計"
            ]
          },
          {
            "name": "pandas",
            "proficiency": "core",
            "experienceYears": 4,
            "lastUsed": "現在",
            "contexts": [
              "前処理",
              "集計"
            ]
          }
        ]
      },
      {
        "name": "開発ツール",
        "items": [
          {
            "name": "Git / GitHub",
            "proficiency": "working",
            "experienceYears": 3,
            "lastUsed": "現在",
            "contexts": [
              "バージョン管理",
              "レビュー"
            ]
          }
        ]
      }
    ]
  },
  "strengths": [
    {
      "title": "業務を理解して仕組みに落とす力",
      "description": "利用者の要望をそのまま実装するのではなく、現行業務と目的を整理して、必要なデータ・画面・処理へ分解します。",
      "evidence": "業務ヒアリングから設計・実装・運用改善まで一貫して担当。",
      "relatedProjectIds": [
        "project-1"
      ]
    },
    {
      "title": "作って終わらせない改善力",
      "description": "利用開始後の反応や運用状況を確認し、継続して使われる状態まで改善します。",
      "evidence": "利用者向け説明と運用手順の整備を実施。",
      "relatedProjectIds": [
        "project-1"
      ]
    }
  ],
  "certifications": [
    {
      "name": "応用情報技術者試験",
      "acquiredAt": "2025.04",
      "issuer": "IPA"
    }
  ],
  "futureInterests": [
    "生成AIを活用した業務システム開発"
  ],
  "presentation": {
    "theme": "business-navy",
    "pageSize": "A4-landscape",
    "sectionOrder": [
      "title",
      "summary",
      "career",
      "projects",
      "skills",
      "strengths",
      "direction"
    ]
  }
}
